{"version": 1, "source_pdf": "c05924700e83.pdf", "origin": "stripped", "family": "real/Acrobat", "pages": [{"page": 1, "width": 612.0, "height": 792.0}, {"page": 2, "width": 612.0, "height": 792.0}, {"page": 3, "width": 612.0, "height": 792.0}], "widgets": [{"page": 2, "type": "text", "rect": [125.723, 729.672, 486.638, 745.215]}, {"page": 2, "type": "text", "rect": [238.533, 711.898, 374.33, 733.898]}, {"page": 2, "type": "text", "rect": [459.787, 710.607, 583.949, 732.607]}, {"page": 2, "type": "text", "rect": [300.541, 645.05, 356.181, 667.05]}, {"page": 2, "type": "text", "rect": [238.621, 347.167, 374.419, 369.167]}, {"page": 2, "type": "text", "rect": [456.802, 345.876, 583.038, 367.876]}, {"page": 2, "type": "text", "rect": [300.629, 280.319, 357.15, 302.319]}]}