{"version": 1, "source_pdf": "855ea1a376c1.pdf", "origin": "stripped", "family": "real/Adobe", "pages": [{"page": 1, "width": 612.0, "height": 792.0}, {"page": 2, "width": 612.0, "height": 792.0}], "widgets": [{"page": 1, "type": "text", "rect": [26.101, 545.758, 282.061, 559.438]}, {"page": 1, "type": "text", "rect": [287.101, 545.758, 424.442, 559.438]}, {"page": 1, "type": "checkbox", "rect": [47.409, 505.34, 57.409, 515.34]}, {"page": 1, "type": "text", "rect": [150.86, 474.66, 232.559, 488.34]}, {"page": 1, "type": "text", "rect": [26.101, 442.441, 304.56, 455.82]}, {"page": 1, "type": "text", "rect": [309.6, 442.441, 588.059, 455.82]}, {"page": 1, "type": "text", "rect": [26.101, 417.601, 223.56, 429.341]}, {"page": 1, "type": "text", "rect": [228.6, 417.598, 588.061, 429.004]}, {"page": 1, "type": "text", "rect": [26.101, 391.678, 403.56, 403.983]}, {"page": 1, "type": "text", "rect": [408.6, 391.678, 588.061, 405.017]}, {"page": 1, "type": "text", "rect": [26.101, 365.758, 223.562, 378.06]}, {"page": 1, "type": "text", "rect": [228.6, 365.758, 403.56, 378.06]}, {"page": 1, "type": "text", "rect": [408.6, 365.758, 588.061, 378.06]}, {"page": 1, "type": "text", "rect": [26.101, 339.614, 304.741, 353.0]}, {"page": 1, "type": "text", "rect": [310.105, 339.612, 588.059, 352.998]}, {"page": 1, "type": "checkbox", "rect": [32.394, 317.051, 42.394, 327.051]}, {"page": 1, "type": "checkbox", "rect": [92.191, 317.051, 102.191, 327.051]}, {"page": 1, "type": "checkbox", "rect": [158.392, 317.051, 168.392, 327.051]}, {"page": 1, "type": "checkbox", "rect": [216.893, 317.051, 226.893, 327.051]}, {"page": 1, "type": "checkbox", "rect": [361.395, 317.663, 371.395, 327.663]}, {"page": 1, "type": "checkbox", "rect": [417.736, 317.663, 427.736, 327.663]}, {"page": 1, "type": "checkbox", "rect": [360.955, 300.641, 370.955, 310.641]}, {"page": 1, "type": "checkbox", "rect": [417.115, 300.641, 427.115, 310.641]}, {"page": 1, "type": "checkbox", "rect": [32.394, 274.705, 42.394, 284.705]}, {"page": 1, "type": "checkbox", "rect": [166.456, 274.705, 176.456, 284.705]}, {"page": 1, "type": "checkbox", "rect": [300.376, 274.705, 310.376, 284.705]}, {"page": 1, "type": "checkbox", "rect": [417.016, 274.705, 427.016, 284.705]}, {"page": 1, "type": "checkbox", "rect": [32.357, 236.561, 42.357, 246.561]}, {"page": 1, "type": "checkbox", "rect": [165.268, 236.561, 175.268, 246.561]}, {"page": 1, "type": "checkbox", "rect": [302.357, 236.561, 312.357, 246.561]}, {"page": 1, "type": "checkbox", "rect": [32.357, 218.561, 42.357, 228.561]}, {"page": 1, "type": "checkbox", "rect": [165.268, 218.561, 175.268, 228.561]}, {"page": 1, "type": "checkbox", "rect": [302.357, 218.561, 312.357, 228.561]}, {"page": 1, "type": "checkbox", "rect": [477.856, 218.561, 487.856, 228.561]}, {"page": 1, "type": "checkbox", "rect": [32.357, 185.246, 42.357, 195.246]}, {"page": 1, "type": "checkbox", "rect": [128.837, 185.246, 138.837, 195.246]}, {"page": 1, "type": "checkbox", "rect": [246.197, 185.246, 256.197, 195.246]}, {"page": 1, "type": "checkbox", "rect": [32.357, 138.276, 42.357, 148.276]}, {"page": 1, "type": "checkbox", "rect": [78.437, 138.276, 88.437, 148.276]}, {"page": 1, "type": "checkbox", "rect": [131.357, 138.276, 141.357, 148.276]}, {"page": 1, "type": "checkbox", "rect": [212.357, 138.276, 222.357, 148.276]}, {"page": 1, "type": "checkbox", "rect": [338.896, 138.276, 348.896, 148.276]}, {"page": 1, "type": "checkbox", "rect": [384.976, 138.276, 394.976, 148.276]}, {"page": 1, "type": "checkbox", "rect": [429.616, 138.276, 439.616, 148.276]}, {"page": 1, "type": "checkbox", "rect": [32.361, 104.799, 42.361, 114.799]}, {"page": 1, "type": "checkbox", "rect": [78.441, 104.799, 88.441, 114.799]}, {"page": 1, "type": "checkbox", "rect": [123.081, 104.799, 133.081, 114.799]}, {"page": 1, "type": "checkbox", "rect": [240.795, 105.125, 250.795, 115.125]}, {"page": 1, "type": "checkbox", "rect": [296.955, 105.125, 306.955, 115.125]}, {"page": 1, "type": "checkbox", "rect": [347.792, 105.125, 357.792, 115.125]}, {"page": 1, "type": "text", "rect": [392.76, 103.855, 580.68, 114.655]}, {"page": 1, "type": "checkbox", "rect": [32.355, 71.65, 42.355, 81.65]}, {"page": 1, "type": "checkbox", "rect": [136.035, 71.65, 146.035, 81.65]}, {"page": 1, "type": "checkbox", "rect": [252.675, 71.65, 262.675, 81.65]}, {"page": 1, "type": "checkbox", "rect": [326.115, 71.65, 336.115, 81.65]}, {"page": 1, "type": "checkbox", "rect": [389.475, 71.65, 399.475, 81.65]}, {"page": 1, "type": "checkbox", "rect": [438.435, 71.65, 448.435, 81.65]}, {"page": 1, "type": "checkbox", "rect": [488.835, 71.65, 498.835, 81.65]}, {"page": 1, "type": "checkbox", "rect": [32.355, 42.85, 42.355, 52.85]}, {"page": 1, "type": "checkbox", "rect": [78.435, 42.85, 88.435, 52.85]}, {"page": 1, "type": "checkbox", "rect": [123.075, 42.85, 133.075, 52.85]}, {"page": 2, "type": "text", "rect": [33.443, 702.303, 244.403, 726.839]}, {"page": 2, "type": "text", "rect": [380.483, 702.302, 577.763, 726.839]}, {"page": 2, "type": "text", "rect": [31.283, 615.972, 316.403, 633.06]}, {"page": 2, "type": "text", "rect": [378.323, 615.239, 527.074, 633.06]}]}