{"version": 1, "source_pdf": "021b4c42bfff.pdf", "origin": "stripped", "family": "real/Adobe", "pages": [{"page": 1, "width": 612.0, "height": 792.0}, {"page": 2, "width": 612.0, "height": 792.0}, {"page": 3, "width": 612.0, "height": 792.0}, {"page": 4, "width": 612.0, "height": 792.0}, {"page": 5, "width": 612.0, "height": 792.0}, {"page": 6, "width": 612.0, "height": 792.0}, {"page": 7, "width": 612.0, "height": 792.0}, {"page": 8, "width": 612.0, "height": 792.0}, {"page": 9, "width": 612.0, "height": 792.0}, {"page": 10, "width": 612.0, "height": 792.0}, {"page": 11, "width": 612.0, "height": 792.0}, {"page": 12, "width": 612.0, "height": 792.0}, {"page": 13, "width": 612.0, "height": 792.0}, {"page": 14, "width": 612.0, "height": 792.0}, {"page": 15, "width": 612.0, "height": 792.0}], "widgets": [{"page": 5, "type": "text", "rect": [43.2, 358.88, 200.16, 376.88]}, {"page": 5, "type": "text", "rect": [129.84, 342.92, 151.08, 360.92]}, {"page": 5, "type": "text", "rect": [327.6, 359.12, 484.56, 377.12]}, {"page": 5, "type": "text", "rect": [455.52, 343.16, 476.88, 361.16]}, {"page": 7, "type": "text", "rect": [347.76, 120.12, 450.96, 138.12]}, {"page": 7, "type": "text", "rect": [347.76, 84.0, 450.96, 102.0]}, {"page": 7, "type": "text", "rect": [347.76, 47.1055, 450.96, 65.1055]}, {"page": 9, "type": "text", "rect": [41.6424, 282.273, 570.776, 498.937]}, {"page": 10, "type": "text", "rect": [41.6424, 43.412, 570.776, 349.873]}, {"page": 12, "type": "text", "rect": [41.6424, 154.761, 570.776, 517.795]}, {"page": 13, "type": "text", "rect": [41.6424, 373.663, 570.776, 473.59]}, {"page": 13, "type": "text", "rect": [41.6424, 136.801, 570.776, 265.464]}, {"page": 14, "type": "text", "rect": [41.6424, 526.522, 570.776, 648.899]}, {"page": 14, "type": "text", "rect": [41.6424, 130.516, 570.776, 428.895]}, {"page": 15, "type": "text", "rect": [94.92, 579.92, 193.92, 597.92]}, {"page": 15, "type": "text", "rect": [119.4, 563.84, 147.72, 581.84]}, {"page": 15, "type": "text", "rect": [119.4, 284.04, 147.72, 302.04]}, {"page": 15, "type": "text", "rect": [363.0, 578.84, 462.12, 596.84]}, {"page": 15, "type": "text", "rect": [391.56, 562.88, 419.88, 580.88]}, {"page": 15, "type": "text", "rect": [327.6, 410.52, 568.92, 428.52]}, {"page": 15, "type": "text", "rect": [363.0, 300.12, 462.12, 318.12]}, {"page": 15, "type": "text", "rect": [391.56, 284.04, 419.88, 302.04]}]}