{"version": 1, "source_pdf": "43b1efcebeb7.pdf", "origin": "stripped", "family": "real/Acrobat", "pages": [{"page": 1, "width": 612.0, "height": 792.0}, {"page": 2, "width": 612.0, "height": 792.0}], "widgets": [{"page": 1, "type": "checkbox", "rect": [54.332504, 181.009048, 65.332336, 192.342209]}, {"page": 1, "type": "text", "rect": [124.998093, 148.00972, 279.329071, 165.342789]}, {"page": 1, "type": "text", "rect": [329.150391, 393.847961, 554.298401, 411.276947]}, {"page": 1, "type": "text", "rect": [329.150391, 324.417816, 554.298401, 341.846771]}, {"page": 1, "type": "text", "rect": [329.150391, 290.131317, 554.298401, 307.560272]}, {"page": 1, "type": "text", "rect": [388.866028, 49.983078, 554.584106, 67.126328]}]}