{"version": 1, "source_pdf": "f001d9d6682d.pdf", "origin": "stripped", "family": "real/Microsoft\u00ae", "pages": [{"page": 1, "width": 612.0, "height": 792.0}, {"page": 2, "width": 612.0, "height": 792.0}, {"page": 3, "width": 612.0, "height": 792.0}], "widgets": [{"page": 1, "type": "text", "rect": [265.166, 203.138, 576.758, 225.138]}, {"page": 1, "type": "checkbox", "rect": [122.913, 142.673, 140.913, 160.673]}, {"page": 1, "type": "text", "rect": [43.8362, 89.2494, 300.418, 111.249]}, {"page": 1, "type": "text", "rect": [304.705, 87.9601, 578.048, 109.96]}, {"page": 2, "type": "text", "rect": [37.3897, 687.055, 123.354, 709.055]}, {"page": 2, "type": "text", "rect": [126.781, 684.906, 259.161, 706.906]}, {"page": 2, "type": "text", "rect": [265.166, 684.906, 390.24, 706.906]}, {"page": 2, "type": "text", "rect": [389.799, 684.047, 490.375, 706.047]}, {"page": 2, "type": "text", "rect": [494.233, 684.906, 573.751, 706.906]}, {"page": 2, "type": "text", "rect": [40.8279, 612.276, 118.627, 634.276]}, {"page": 2, "type": "text", "rect": [128.93, 612.276, 261.31, 634.276]}, {"page": 2, "type": "text", "rect": [266.026, 611.416, 387.661, 633.416]}, {"page": 2, "type": "text", "rect": [394.526, 611.846, 486.078, 633.846]}, {"page": 2, "type": "text", "rect": [489.505, 610.557, 574.61, 632.557]}, {"page": 2, "type": "text", "rect": [267.745, 551.249, 485.648, 573.249]}, {"page": 2, "type": "text", "rect": [494.233, 550.389, 571.602, 572.389]}, {"page": 2, "type": "checkbox", "rect": [43.8362, 449.096, 61.8362, 467.096]}, {"page": 2, "type": "checkbox", "rect": [336.507, 447.807, 354.507, 465.807]}, {"page": 3, "type": "text", "rect": [41.2576, 613.135, 571.171, 712.923]}, {"page": 3, "type": "text", "rect": [270.323, 502.685, 384.653, 524.685]}, {"page": 3, "type": "text", "rect": [402.692, 497.098, 552.692, 516.52]}, {"page": 3, "type": "text", "rect": [159.014, 269.751, 376.917, 291.751]}, {"page": 3, "type": "text", "rect": [393.237, 269.751, 564.725, 291.751]}, {"page": 3, "type": "text", "rect": [39.5385, 268.462, 151.289, 290.462]}, {"page": 3, "type": "checkbox", "rect": [35.6707, 735.751, 53.6707, 753.751]}]}