{"version": 1, "source_pdf": "37f6acade5d1.pdf", "origin": "stripped", "family": "real/Designer", "pages": [{"page": 1, "width": 612.0, "height": 792.0}, {"page": 2, "width": 612.0, "height": 792.0}, {"page": 3, "width": 612.0, "height": 792.0}, {"page": 4, "width": 612.0, "height": 792.0}, {"page": 5, "width": 612.0, "height": 792.0}, {"page": 6, "width": 612.0, "height": 792.0}], "widgets": [{"page": 1, "type": "text", "rect": [226.44, 667.225, 381.6, 684.627]}, {"page": 1, "type": "text", "rect": [384.48, 667.225, 486.72, 684.627]}, {"page": 1, "type": "text", "rect": [489.6, 667.009, 592.56, 684.627]}, {"page": 1, "type": "text", "rect": [21.6, 619.705, 304.56, 635.545]}, {"page": 1, "type": "text", "rect": [307.44, 619.705, 592.56, 635.545]}, {"page": 1, "type": "text", "rect": [21.6, 589.465, 592.56, 605.305]}, {"page": 1, "type": "text", "rect": [21.6, 559.225, 254.88, 575.065]}, {"page": 1, "type": "text", "rect": [257.76, 559.225, 354.24, 575.065]}, {"page": 1, "type": "text", "rect": [357.12, 559.225, 433.44, 575.065]}, {"page": 1, "type": "text", "rect": [436.32, 559.225, 592.56, 575.065]}, {"page": 1, "type": "text", "rect": [21.6, 528.985, 190.083, 544.825]}, {"page": 1, "type": "text", "rect": [193.68, 528.985, 363.6, 544.825]}, {"page": 1, "type": "text", "rect": [366.48, 528.985, 491.76, 544.825]}, {"page": 1, "type": "checkbox", "rect": [497.475, 533.261, 506.475, 542.261]}, {"page": 1, "type": "checkbox", "rect": [524.835, 533.261, 533.835, 542.261]}, {"page": 1, "type": "checkbox", "rect": [552.195, 533.261, 561.195, 542.261]}, {"page": 1, "type": "checkbox", "rect": [26.306, 506.7, 35.306, 515.7]}, {"page": 1, "type": "checkbox", "rect": [101.798, 506.7, 110.798, 515.7]}, {"page": 1, "type": "checkbox", "rect": [26.306, 493.74, 35.306, 502.74]}, {"page": 1, "type": "checkbox", "rect": [26.306, 479.34, 35.306, 488.34]}, {"page": 1, "type": "checkbox", "rect": [41.715, 362.587, 50.715, 371.587]}, {"page": 1, "type": "checkbox", "rect": [110.835, 362.587, 119.835, 371.587]}, {"page": 1, "type": "checkbox", "rect": [179.955, 362.587, 188.955, 371.587]}, {"page": 1, "type": "text", "rect": [224.3, 296.391, 299.582, 329.511]}, {"page": 1, "type": "text", "rect": [567.204, 370.8, 592.364, 394.56]}, {"page": 1, "type": "text", "rect": [567.206, 339.84, 592.364, 367.2]}, {"page": 1, "type": "text", "rect": [567.204, 309.6, 592.364, 336.96]}, {"page": 1, "type": "text", "rect": [21.6, 259.055, 592.56, 275.04]}, {"page": 1, "type": "text", "rect": [21.6, 228.67, 254.88, 244.655]}, {"page": 1, "type": "text", "rect": [257.76, 228.67, 354.24, 244.655]}, {"page": 1, "type": "text", "rect": [357.12, 228.67, 433.44, 244.655]}, {"page": 1, "type": "text", "rect": [436.32, 228.67, 592.56, 244.661]}, {"page": 1, "type": "text", "rect": [21.6, 198.283, 194.4, 214.268]}, {"page": 1, "type": "text", "rect": [197.28, 198.283, 305.28, 214.268]}, {"page": 1, "type": "text", "rect": [308.16, 198.283, 592.56, 214.268]}, {"page": 1, "type": "checkbox", "rect": [298.256, 183.61, 307.256, 192.61]}, {"page": 1, "type": "checkbox", "rect": [333.315, 183.61, 342.315, 192.61]}, {"page": 1, "type": "checkbox", "rect": [424.755, 165.645, 433.755, 174.645]}, {"page": 1, "type": "checkbox", "rect": [451.503, 165.645, 460.503, 174.645]}, {"page": 1, "type": "checkbox", "rect": [114.435, 131.683, 123.435, 140.683]}, {"page": 1, "type": "checkbox", "rect": [142.132, 131.683, 151.132, 140.683]}, {"page": 1, "type": "text", "rect": [514.21, 46.355, 592.56, 79.648]}, {"page": 1, "type": "checkbox", "rect": [313.155, 460.62, 322.155, 469.62]}, {"page": 1, "type": "checkbox", "rect": [349.155, 460.62, 358.155, 469.62]}, {"page": 1, "type": "checkbox", "rect": [313.155, 444.78, 322.155, 453.78]}, {"page": 1, "type": "checkbox", "rect": [349.155, 444.78, 358.155, 453.78]}, {"page": 2, "type": "text", "rect": [313.92, 671.939, 427.929, 708.208]}, {"page": 2, "type": "text", "rect": [503.172, 671.939, 592.56, 709.56]}, {"page": 2, "type": "checkbox", "rect": [245.35, 603.849, 254.35, 612.849]}, {"page": 2, "type": "checkbox", "rect": [277.03, 603.849, 286.03, 612.849]}, {"page": 2, "type": "text", "rect": [514.627, 595.973, 592.56, 621.893]}, {"page": 2, "type": "text", "rect": [514.681, 565.733, 592.56, 591.653]}, {"page": 2, "type": "text", "rect": [351.955, 427.187, 495.955, 452.387]}, {"page": 2, "type": "text", "rect": [25.716, 329.21, 246.988, 354.41]}, {"page": 2, "type": "text", "rect": [461.991, 330.65, 585.122, 352.97]}, {"page": 2, "type": "text", "rect": [21.6, 249.443, 240.355, 269.819]}, {"page": 2, "type": "text", "rect": [243.235, 249.443, 460.675, 269.817]}, {"page": 2, "type": "text", "rect": [463.555, 249.443, 592.56, 269.819]}, {"page": 2, "type": "text", "rect": [19.44, 147.203, 199.123, 173.123]}, {"page": 2, "type": "text", "rect": [202.003, 147.203, 261.61, 173.123]}, {"page": 2, "type": "text", "rect": [264.49, 147.203, 456.73, 173.123]}, {"page": 2, "type": "text", "rect": [459.61, 147.203, 522.604, 173.123]}, {"page": 2, "type": "text", "rect": [525.484, 147.203, 592.56, 173.123]}, {"page": 2, "type": "text", "rect": [19.44, 118.403, 199.123, 144.323]}, {"page": 2, "type": "text", "rect": [202.003, 118.403, 261.61, 144.323]}, {"page": 2, "type": "text", "rect": [264.49, 118.403, 456.73, 144.323]}, {"page": 2, "type": "text", "rect": [459.61, 118.403, 522.604, 144.323]}, {"page": 2, "type": "text", "rect": [525.484, 118.403, 592.56, 144.323]}, {"page": 2, "type": "text", "rect": [19.44, 89.603, 199.123, 115.523]}, {"page": 2, "type": "text", "rect": [202.003, 89.603, 261.61, 115.523]}, {"page": 2, "type": "text", "rect": [264.49, 89.603, 456.73, 115.523]}, {"page": 2, "type": "text", "rect": [459.61, 89.603, 522.604, 115.523]}, {"page": 2, "type": "text", "rect": [525.484, 89.603, 592.56, 115.523]}, {"page": 2, "type": "text", "rect": [19.44, 60.803, 199.123, 86.723]}, {"page": 2, "type": "text", "rect": [202.003, 60.803, 261.61, 86.723]}, {"page": 2, "type": "text", "rect": [264.49, 60.803, 456.73, 86.723]}, {"page": 2, "type": "text", "rect": [459.61, 60.803, 522.604, 86.723]}, {"page": 2, "type": "text", "rect": [525.484, 60.803, 592.56, 86.723]}, {"page": 3, "type": "checkbox", "rect": [397.395, 660.82, 406.395, 669.82]}, {"page": 3, "type": "checkbox", "rect": [447.795, 660.82, 456.795, 669.82]}, {"page": 3, "type": "checkbox", "rect": [522.675, 660.82, 531.675, 669.82]}, {"page": 3, "type": "checkbox", "rect": [397.395, 643.812, 406.395, 652.812]}, {"page": 3, "type": "checkbox", "rect": [447.795, 643.812, 456.795, 652.812]}, {"page": 3, "type": "checkbox", "rect": [30.195, 604.66, 39.195, 613.66]}, {"page": 3, "type": "checkbox", "rect": [165.555, 604.66, 174.555, 613.66]}, {"page": 3, "type": "checkbox", "rect": [286.515, 604.66, 295.515, 613.66]}, {"page": 3, "type": "checkbox", "rect": [393.075, 604.66, 402.075, 613.66]}, {"page": 3, "type": "checkbox", "rect": [485.235, 604.66, 494.235, 613.66]}, {"page": 3, "type": "checkbox", "rect": [30.195, 584.5, 39.195, 593.5]}, {"page": 3, "type": "checkbox", "rect": [165.555, 584.5, 174.555, 593.5]}, {"page": 3, "type": "checkbox", "rect": [286.515, 584.5, 295.515, 593.5]}, {"page": 3, "type": "checkbox", "rect": [393.075, 584.5, 402.075, 593.5]}, {"page": 3, "type": "checkbox", "rect": [30.195, 562.9, 39.195, 571.9]}, {"page": 3, "type": "checkbox", "rect": [165.555, 562.9, 174.555, 571.9]}, {"page": 3, "type": "checkbox", "rect": [286.515, 562.9, 295.515, 571.9]}, {"page": 3, "type": "checkbox", "rect": [393.075, 562.9, 402.075, 571.9]}, {"page": 3, "type": "checkbox", "rect": [166.995, 365.166, 175.995, 374.166]}, {"page": 3, "type": "checkbox", "rect": [203.715, 365.166, 212.715, 374.166]}, {"page": 3, "type": "checkbox", "rect": [318.195, 365.166, 327.195, 374.166]}, {"page": 3, "type": "checkbox", "rect": [391.635, 365.166, 400.635, 374.166]}, {"page": 3, "type": "checkbox", "rect": [472.275, 365.166, 481.275, 374.166]}, {"page": 3, "type": "checkbox", "rect": [318.195, 321.966, 327.195, 330.966]}, {"page": 3, "type": "checkbox", "rect": [354.195, 321.966, 363.195, 330.966]}, {"page": 3, "type": "checkbox", "rect": [472.275, 321.966, 481.275, 330.966]}, {"page": 3, "type": "checkbox", "rect": [506.835, 321.966, 515.835, 330.966]}]}