{"version": 1, "source_pdf": "24f7badd3ae1.pdf", "origin": "stripped", "family": "real/Adobe", "pages": [{"page": 1, "width": 612.0, "height": 792.0}, {"page": 2, "width": 612.0, "height": 792.0}], "widgets": [{"page": 1, "type": "choice", "rect": [195.729, 725.761, 304.931, 740.161]}, {"page": 1, "type": "choice", "rect": [207.054, 709.2, 354.48, 723.6]}, {"page": 1, "type": "text", "rect": [36.0412, 690.352, 240.774, 704.752]}, {"page": 1, "type": "checkbox", "rect": [35.9537, 601.669, 47.144, 612.767]}, {"page": 1, "type": "checkbox", "rect": [124.835, 601.584, 135.985, 612.765]}, {"page": 1, "type": "text", "rect": [35.7355, 526.134, 186.686, 540.534]}, {"page": 1, "type": "text", "rect": [187.87, 526.145, 239.93, 540.545]}, {"page": 1, "type": "text", "rect": [432.505, 544.945, 574.401, 559.345]}, {"page": 1, "type": "text", "rect": [126.397, 363.492, 216.148, 376.583]}, {"page": 1, "type": "choice", "rect": [270.594, 363.213, 468.529, 375.758]}, {"page": 1, "type": "text", "rect": [35.7452, 350.505, 249.532, 362.777]}, {"page": 1, "type": "text", "rect": [253.965, 350.985, 432.57, 362.658]}, {"page": 1, "type": "text", "rect": [100.979, 276.219, 252.475, 290.619]}, {"page": 1, "type": "text", "rect": [283.584, 276.409, 358.212, 290.809]}, {"page": 1, "type": "checkbox", "rect": [358.969, 278.126, 367.002, 286.176]}, {"page": 1, "type": "text", "rect": [481.086, 276.709, 578.732, 291.109]}, {"page": 1, "type": "text", "rect": [63.6313, 112.997, 254.768, 125.957]}, {"page": 1, "type": "text", "rect": [123.286, 99.655, 255.077, 112.615]}, {"page": 1, "type": "text", "rect": [74.577, 85.2913, 254.15, 98.2513]}, {"page": 1, "type": "text", "rect": [99.7406, 71.255, 254.223, 84.215]}, {"page": 1, "type": "text", "rect": [322.577, 133.255, 578.732, 147.655]}, {"page": 1, "type": "text", "rect": [323.413, 108.746, 576.514, 123.146]}, {"page": 1, "type": "text", "rect": [323.813, 82.4913, 576.368, 96.8913]}, {"page": 2, "type": "text", "rect": [146.695, 610.588, 327.374, 624.988]}, {"page": 2, "type": "text", "rect": [397.514, 610.909, 538.266, 625.309]}, {"page": 2, "type": "text", "rect": [247.732, 472.785, 543.611, 487.185]}, {"page": 2, "type": "text", "rect": [221.224, 444.829, 399.809, 459.229]}, {"page": 2, "type": "text", "rect": [427.013, 445.091, 543.547, 459.491]}, {"page": 2, "type": "text", "rect": [324.052, 417.492, 542.891, 431.892]}, {"page": 2, "type": "text", "rect": [178.445, 389.819, 255.139, 404.219]}, {"page": 2, "type": "text", "rect": [281.507, 389.673, 399.219, 404.073]}, {"page": 2, "type": "text", "rect": [487.908, 390.0, 543.438, 404.4]}, {"page": 2, "type": "text", "rect": [223.444, 362.128, 399.246, 376.528]}, {"page": 2, "type": "text", "rect": [224.916, 334.637, 543.246, 349.037]}, {"page": 2, "type": "text", "rect": [362.974, 279.474, 423.304, 293.874]}, {"page": 2, "type": "text", "rect": [439.799, 279.098, 503.794, 293.498]}, {"page": 2, "type": "text", "rect": [107.863, 242.505, 225.204, 256.905]}, {"page": 2, "type": "text", "rect": [309.183, 242.619, 437.215, 257.019]}, {"page": 2, "type": "text", "rect": [443.001, 242.765, 533.724, 257.165]}, {"page": 2, "type": "text", "rect": [107.862, 210.435, 222.476, 224.835]}, {"page": 2, "type": "text", "rect": [228.09, 210.024, 306.867, 224.424]}, {"page": 2, "type": "text", "rect": [388.029, 166.411, 533.407, 180.811]}, {"page": 2, "type": "text", "rect": [323.889, 125.36, 543.23, 139.76]}, {"page": 2, "type": "text", "rect": [343.125, 97.3337, 543.321, 111.734]}, {"page": 2, "type": "text", "rect": [315.075, 69.6618, 543.579, 84.0619]}]}