{"version": 1, "source_pdf": "a7d3cc2d2ab5.pdf", "origin": "stripped", "family": "real/Adobe", "pages": [{"page": 1, "width": 612.0, "height": 792.0}], "widgets": [{"page": 1, "type": "text", "rect": [55.92, 465.0, 319.08, 490.08]}, {"page": 1, "type": "text", "rect": [321.12, 465.0, 562.32, 490.08]}, {"page": 1, "type": "text", "rect": [189.525, 412.32, 560.76, 436.389]}, {"page": 1, "type": "text", "rect": [222.7, 389.04, 560.76, 411.32]}, {"page": 1, "type": "text", "rect": [227.938, 364.56, 560.76, 387.647]}, {"page": 1, "type": "text", "rect": [283.495, 305.816, 560.64, 329.25]}, {"page": 1, "type": "text", "rect": [177.423, 278.096, 560.64, 301.683]}, {"page": 1, "type": "text", "rect": [55.8, 105.36, 560.04, 255.6]}, {"page": 1, "type": "text", "rect": [179.081, 340.979, 261.422, 362.542]}, {"page": 1, "type": "text", "rect": [379.978, 350.605, 529.978, 363.145]}]}