{"version": 1, "source_pdf": "1f697fad5785.pdf", "origin": "stripped", "family": "real/GPL", "pages": [{"page": 1, "width": 612.0, "height": 792.0}, {"page": 2, "width": 612.0, "height": 792.0}, {"page": 3, "width": 612.0, "height": 792.0}, {"page": 4, "width": 612.0, "height": 792.0}, {"page": 5, "width": 612.0, "height": 792.0}, {"page": 6, "width": 612.0, "height": 792.0}, {"page": 7, "width": 612.0, "height": 792.0}, {"page": 8, "width": 612.0, "height": 792.0}, {"page": 9, "width": 612.0, "height": 792.0}, {"page": 10, "width": 612.0, "height": 792.0}, {"page": 11, "width": 612.0, "height": 792.0}, {"page": 12, "width": 612.0, "height": 792.0}, {"page": 13, "width": 612.0, "height": 792.0}, {"page": 14, "width": 612.0, "height": 792.0}], "widgets": [{"page": 1, "type": "text", "rect": [145.2, 597.68, 539.28, 621.92]}, {"page": 1, "type": "text", "rect": [146.52, 562.04, 540.12, 585.44]}, {"page": 1, "type": "text", "rect": [151.2, 498.92, 540.12, 523.16]}, {"page": 1, "type": "text", "rect": [180.84, 473.72, 540.12, 497.96]}, {"page": 1, "type": "text", "rect": [119.64, 450.68, 288.12, 472.76]}, {"page": 1, "type": "text", "rect": [318.12, 450.68, 540.12, 472.76]}, {"page": 1, "type": "text", "rect": [109.56, 425.48, 540.12, 449.72]}, {"page": 1, "type": "text", "rect": [72.1777, 374.96, 247.32, 399.2]}, {"page": 1, "type": "text", "rect": [252.0, 374.96, 463.32, 399.2]}, {"page": 1, "type": "text", "rect": [468.0, 374.96, 540.12, 399.2]}, {"page": 1, "type": "text", "rect": [71.6456, 276.32, 247.32, 300.56]}, {"page": 1, "type": "text", "rect": [252.0, 276.32, 377.893, 300.56]}, {"page": 1, "type": "text", "rect": [383.544, 276.327, 466.056, 300.567]}, {"page": 1, "type": "text", "rect": [468.0, 276.32, 540.16, 300.56]}, {"page": 1, "type": "text", "rect": [119.64, 240.68, 288.12, 264.92]}, {"page": 1, "type": "text", "rect": [318.12, 240.68, 540.12, 264.92]}, {"page": 1, "type": "text", "rect": [182.28, 202.88, 254.64, 227.12]}, {"page": 1, "type": "text", "rect": [250.607, 165.381, 352.127, 189.621]}, {"page": 1, "type": "text", "rect": [180.816, 125.032, 289.189, 149.272]}, {"page": 1, "type": "text", "rect": [431.655, 125.032, 540.45, 149.272]}, {"page": 2, "type": "text", "rect": [70.88, 625.953, 546.424, 721.118]}, {"page": 2, "type": "text", "rect": [114.24, 584.84, 174.48, 601.52]}, {"page": 2, "type": "text", "rect": [241.08, 584.84, 301.32, 601.52]}, {"page": 2, "type": "text", "rect": [436.68, 584.84, 497.04, 603.209]}, {"page": 2, "type": "text", "rect": [189.84, 464.36, 504.12, 481.04]}, {"page": 2, "type": "text", "rect": [188.28, 399.8, 540.12, 416.48]}, {"page": 2, "type": "text", "rect": [252.0, 381.8, 540.12, 398.48]}, {"page": 2, "type": "text", "rect": [195.84, 364.28, 540.12, 380.84]}, {"page": 2, "type": "text", "rect": [187.32, 346.64, 504.12, 363.32]}, {"page": 3, "type": "checkbox", "rect": [89.2891, 348.469, 101.621, 360.801]}, {"page": 3, "type": "checkbox", "rect": [89.2101, 317.323, 101.542, 329.655]}, {"page": 3, "type": "checkbox", "rect": [89.2101, 194.847, 101.542, 207.179]}, {"page": 4, "type": "text", "rect": [167.264, 689.47, 252.104, 713.23]}, {"page": 4, "type": "text", "rect": [438.72, 572.731, 540.12, 590.371]}, {"page": 4, "type": "checkbox", "rect": [89.3534, 513.11, 103.265, 527.2]}, {"page": 4, "type": "text", "rect": [181.8, 510.506, 396.12, 528.146]}, {"page": 4, "type": "text", "rect": [198.36, 491.786, 396.12, 509.426]}, {"page": 4, "type": "text", "rect": [201.84, 473.186, 396.12, 490.826]}, {"page": 4, "type": "text", "rect": [145.68, 454.586, 396.12, 472.226]}, {"page": 4, "type": "text", "rect": [130.2, 435.986, 396.12, 453.626]}, {"page": 4, "type": "checkbox", "rect": [436.033, 271.95, 447.588, 283.504]}, {"page": 4, "type": "checkbox", "rect": [469.998, 272.136, 481.552, 283.69]}, {"page": 4, "type": "checkbox", "rect": [158.683, 272.417, 170.238, 283.971]}, {"page": 4, "type": "checkbox", "rect": [196.951, 271.324, 208.505, 282.878]}, {"page": 4, "type": "checkbox", "rect": [230.915, 271.937, 242.47, 283.491]}, {"page": 4, "type": "checkbox", "rect": [275.927, 271.498, 287.481, 283.052]}, {"page": 4, "type": "checkbox", "rect": [515.294, 272.128, 526.849, 283.682]}, {"page": 4, "type": "checkbox", "rect": [398.051, 272.047, 409.605, 283.601]}, {"page": 5, "type": "text", "rect": [106.863, 474.103, 554.452, 732.937]}, {"page": 5, "type": "text", "rect": [108.802, 60.2044, 533.892, 356.435]}, {"page": 6, "type": "text", "rect": [252.0, 540.734, 277.2, 563.68]}, {"page": 6, "type": "text", "rect": [315.24, 541.266, 340.44, 563.68]}, {"page": 6, "type": "text", "rect": [382.44, 541.266, 407.64, 563.68]}, {"page": 6, "type": "checkbox", "rect": [383.683, 468.27, 397.75, 482.686]}, {"page": 6, "type": "text", "rect": [399.72, 466.76, 500.16, 488.11]}, {"page": 6, "type": "text", "rect": [159.28, 332.678, 314.949, 356.918]}, {"page": 6, "type": "text", "rect": [377.977, 332.725, 533.224, 356.965]}, {"page": 6, "type": "text", "rect": [175.8, 242.16, 316.32, 270.96]}, {"page": 6, "type": "text", "rect": [385.8, 242.16, 531.36, 270.96]}, {"page": 7, "type": "text", "rect": [106.885, 454.573, 531.975, 719.123]}, {"page": 9, "type": "text", "rect": [103.794, 550.338, 542.52, 692.333]}, {"page": 9, "type": "text", "rect": [103.431, 335.236, 542.839, 487.952]}, {"page": 9, "type": "text", "rect": [103.135, 56.1136, 542.543, 274.059]}, {"page": 10, "type": "text", "rect": [175.452, 326.499, 235.812, 349.445]}, {"page": 11, "type": "text", "rect": [72.0, 659.96, 92.16, 681.56]}, {"page": 11, "type": "text", "rect": [72.0, 634.04, 92.16, 659.36]}, {"page": 11, "type": "text", "rect": [67.44, 355.36, 87.6, 380.68]}, {"page": 11, "type": "text", "rect": [72.0, 254.32, 92.16, 279.64]}, {"page": 11, "type": "text", "rect": [72.0, 178.6, 92.16, 203.92]}, {"page": 11, "type": "text", "rect": [72.0, 102.88, 92.16, 128.2]}, {"page": 12, "type": "text", "rect": [72.0, 733.36, 92.16, 762.16]}, {"page": 12, "type": "text", "rect": [72.0, 682.96, 92.16, 711.76]}, {"page": 12, "type": "text", "rect": [72.0, 645.499, 92.16, 674.299]}, {"page": 12, "type": "text", "rect": [72.0, 561.849, 288.12, 590.649]}, {"page": 12, "type": "text", "rect": [324.0, 561.849, 540.12, 590.649]}, {"page": 12, "type": "text", "rect": [323.878, 504.236, 540.356, 528.477]}, {"page": 13, "type": "text", "rect": [72.0, 645.28, 92.16, 669.04]}, {"page": 13, "type": "text", "rect": [72.0, 607.36, 92.16, 636.16]}, {"page": 13, "type": "text", "rect": [72.0, 556.96, 92.16, 585.76]}, {"page": 13, "type": "text", "rect": [72.0, 524.44, 92.16, 553.24]}, {"page": 13, "type": "text", "rect": [72.0, 486.64, 92.16, 515.44]}, {"page": 13, "type": "text", "rect": [72.0, 360.0, 92.16, 388.8]}, {"page": 13, "type": "text", "rect": [72.3122, 322.29, 92.4723, 351.09]}, {"page": 13, "type": "text", "rect": [72.0, 234.698, 288.12, 263.498]}, {"page": 13, "type": "text", "rect": [324.0, 234.698, 540.12, 263.498]}, {"page": 13, "type": "text", "rect": [323.972, 177.266, 540.45, 201.506]}]}