{"version": 1, "source_pdf": "1783d04b260c.pdf", "origin": "stripped", "family": "real/Designer", "pages": [{"page": 1, "width": 612.0, "height": 792.0}, {"page": 2, "width": 612.0, "height": 792.0}, {"page": 3, "width": 612.0, "height": 792.0}, {"page": 4, "width": 612.0, "height": 792.0}, {"page": 5, "width": 612.0, "height": 792.0}, {"page": 6, "width": 612.0, "height": 792.0}, {"page": 7, "width": 612.0, "height": 792.0}, {"page": 8, "width": 612.0, "height": 792.0}, {"page": 9, "width": 612.0, "height": 792.0}, {"page": 10, "width": 612.0, "height": 792.0}, {"page": 11, "width": 612.0, "height": 792.0}], "widgets": [{"page": 4, "type": "text", "rect": [128.835, 405.745, 483.163, 423.81]}, {"page": 4, "type": "text", "rect": [488.835, 405.745, 591.163, 423.81]}, {"page": 4, "type": "text", "rect": [20.835, 369.745, 303.163, 387.81]}, {"page": 4, "type": "text", "rect": [223.517, 265.345, 314.64, 279.092]}, {"page": 6, "type": "text", "rect": [121.635, 565.731, 490.363, 580.916]}, {"page": 6, "type": "text", "rect": [496.035, 565.731, 591.163, 580.916]}, {"page": 6, "type": "text", "rect": [20.835, 533.331, 303.163, 548.516]}, {"page": 6, "type": "text", "rect": [128.835, 170.408, 483.163, 185.593]}, {"page": 6, "type": "text", "rect": [488.835, 170.408, 591.163, 185.593]}, {"page": 6, "type": "text", "rect": [20.835, 138.008, 303.163, 153.193]}, {"page": 8, "type": "text", "rect": [20.837, 318.124, 592.582, 421.869]}, {"page": 9, "type": "text", "rect": [20.837, 510.381, 592.582, 614.126]}, {"page": 10, "type": "text", "rect": [121.635, 449.618, 490.363, 464.803]}, {"page": 10, "type": "text", "rect": [496.035, 449.618, 591.163, 464.803]}, {"page": 10, "type": "text", "rect": [20.835, 417.218, 303.163, 432.403]}]}