{"version": 1, "source_pdf": "a62f96966415.pdf", "origin": "stripped", "family": "real/QuarkXPress(R)", "pages": [{"page": 1, "width": 612.0, "height": 792.0}], "widgets": [{"page": 1, "type": "text", "rect": [423.941, 495.36, 563.054, 514.56]}, {"page": 1, "type": "text", "rect": [360.025, 451.92, 563.054, 470.76]}, {"page": 1, "type": "text", "rect": [302.719, 426.72, 563.054, 443.88]}, {"page": 1, "type": "text", "rect": [49.5927, 327.0, 296.553, 345.12]}, {"page": 1, "type": "text", "rect": [504.33, 327.0, 563.054, 345.12]}, {"page": 1, "type": "text", "rect": [273.611, 299.04, 314.705, 318.24]}, {"page": 1, "type": "text", "rect": [421.582, 253.936, 454.615, 272.056]}, {"page": 1, "type": "text", "rect": [413.28, 84.48, 563.4, 102.6]}]}