{"version": 1, "source_pdf": "996b90569e1f.pdf", "origin": "stripped", "family": "real/unknown", "pages": [{"page": 1, "width": 612.0, "height": 792.0}, {"page": 2, "width": 612.0, "height": 792.0}, {"page": 3, "width": 612.0, "height": 792.0}, {"page": 4, "width": 612.0, "height": 792.0}, {"page": 5, "width": 612.0, "height": 792.0}, {"page": 6, "width": 612.0, "height": 792.0}, {"page": 7, "width": 612.0, "height": 792.0}, {"page": 8, "width": 612.0, "height": 792.0}, {"page": 9, "width": 612.0, "height": 792.0}, {"page": 10, "width": 612.0, "height": 792.0}, {"page": 11, "width": 612.0, "height": 792.0}, {"page": 12, "width": 612.0, "height": 792.0}, {"page": 13, "width": 612.0, "height": 792.0}, {"page": 14, "width": 612.0, "height": 792.0}, {"page": 15, "width": 612.0, "height": 792.0}, {"page": 16, "width": 612.0, "height": 792.0}, {"page": 17, "width": 612.0, "height": 792.0}, {"page": 18, "width": 612.0, "height": 792.0}, {"page": 19, "width": 612.0, "height": 792.0}, {"page": 20, "width": 612.0, "height": 792.0}, {"page": 21, "width": 612.0, "height": 792.0}, {"page": 22, "width": 612.0, "height": 792.0}, {"page": 23, "width": 612.0, "height": 792.0}, {"page": 24, "width": 612.0, "height": 792.0}, {"page": 25, "width": 612.0, "height": 792.0}], "widgets": [{"page": 4, "type": "text", "rect": [203.4, 303.48, 570.48, 319.2]}, {"page": 4, "type": "text", "rect": [231.6, 236.04, 565.2, 251.76]}, {"page": 5, "type": "text", "rect": [41.4, 257.16, 574.68, 285.96]}, {"page": 5, "type": "text", "rect": [41.4, 201.36, 574.68, 230.16]}, {"page": 5, "type": "text", "rect": [41.4, 145.56, 574.68, 174.36]}, {"page": 5, "type": "text", "rect": [41.4, 89.76, 574.68, 118.56]}, {"page": 6, "type": "text", "rect": [41.4, 701.88, 574.68, 730.68]}, {"page": 6, "type": "text", "rect": [41.4, 646.08, 574.68, 674.88]}, {"page": 6, "type": "text", "rect": [41.4, 590.28, 574.68, 619.08]}, {"page": 6, "type": "text", "rect": [41.4, 536.16, 574.68, 564.96]}, {"page": 7, "type": "text", "rect": [74.64, 95.16, 574.68, 123.96]}, {"page": 8, "type": "text", "rect": [74.64, 701.88, 574.68, 730.68]}, {"page": 8, "type": "text", "rect": [74.64, 647.76, 574.68, 676.56]}, {"page": 8, "type": "text", "rect": [74.64, 593.76, 574.68, 622.56]}, {"page": 8, "type": "text", "rect": [74.64, 539.64, 574.68, 568.44]}, {"page": 8, "type": "text", "rect": [74.64, 485.52, 574.68, 514.32]}, {"page": 8, "type": "text", "rect": [74.64, 431.4, 574.68, 460.2]}, {"page": 8, "type": "text", "rect": [74.64, 377.28, 574.68, 406.08]}, {"page": 10, "type": "text", "rect": [74.64, 509.52, 574.68, 538.32]}, {"page": 10, "type": "text", "rect": [74.64, 455.4, 574.68, 484.2]}, {"page": 10, "type": "text", "rect": [74.64, 401.28, 574.68, 430.08]}, {"page": 10, "type": "text", "rect": [74.64, 347.28, 574.68, 376.08]}, {"page": 10, "type": "text", "rect": [74.64, 293.16, 574.68, 321.96]}, {"page": 10, "type": "text", "rect": [74.64, 239.04, 574.68, 267.84]}, {"page": 10, "type": "text", "rect": [74.64, 184.92, 574.68, 213.72]}, {"page": 10, "type": "text", "rect": [74.64, 130.8, 574.68, 159.6]}, {"page": 11, "type": "text", "rect": [72.96, 244.2, 326.52, 299.04]}, {"page": 11, "type": "text", "rect": [329.28, 244.2, 574.44, 287.52]}, {"page": 11, "type": "text", "rect": [72.96, 164.52, 326.52, 219.24]}, {"page": 11, "type": "text", "rect": [329.28, 164.52, 574.44, 219.24]}, {"page": 12, "type": "text", "rect": [72.96, 676.32, 326.52, 731.04]}, {"page": 12, "type": "text", "rect": [329.28, 676.32, 574.44, 731.04]}, {"page": 12, "type": "text", "rect": [72.96, 596.64, 326.52, 651.36]}, {"page": 12, "type": "text", "rect": [329.28, 596.64, 574.44, 651.36]}, {"page": 12, "type": "text", "rect": [72.96, 516.96, 326.52, 571.68]}, {"page": 12, "type": "text", "rect": [329.28, 516.96, 574.44, 571.68]}, {"page": 12, "type": "text", "rect": [72.96, 437.16, 326.52, 492.0]}, {"page": 12, "type": "text", "rect": [329.28, 437.16, 574.44, 492.0]}, {"page": 12, "type": "text", "rect": [72.96, 357.48, 326.52, 412.32]}, {"page": 12, "type": "text", "rect": [329.28, 357.48, 574.44, 412.32]}, {"page": 12, "type": "text", "rect": [72.96, 277.8, 326.52, 332.52]}, {"page": 12, "type": "text", "rect": [329.28, 277.8, 574.44, 329.52]}, {"page": 12, "type": "text", "rect": [72.96, 198.12, 326.52, 249.84]}, {"page": 12, "type": "text", "rect": [329.28, 198.12, 574.44, 249.84]}, {"page": 12, "type": "text", "rect": [72.96, 118.44, 326.52, 170.16]}, {"page": 12, "type": "text", "rect": [329.28, 118.44, 574.44, 170.16]}, {"page": 15, "type": "text", "rect": [73.7072, 562.039, 573.193, 596.301]}, {"page": 15, "type": "text", "rect": [74.4512, 451.376, 573.061, 487.39]}, {"page": 15, "type": "text", "rect": [74.4512, 338.252, 573.061, 372.514]}, {"page": 19, "type": "text", "rect": [86.4, 594.0, 560.4, 622.8]}, {"page": 19, "type": "text", "rect": [86.4, 511.2, 560.4, 540.0]}, {"page": 19, "type": "text", "rect": [86.4, 428.4, 560.4, 457.2]}]}