{"version": 1, "source_pdf": "9896f9bec560.pdf", "origin": "stripped", "family": "real/Corel", "pages": [{"page": 1, "width": 612.0, "height": 792.0}], "widgets": [{"page": 1, "type": "text", "rect": [34.0363, 602.437, 582.872, 619.2]}, {"page": 1, "type": "text", "rect": [34.0363, 576.691, 582.872, 593.455]}, {"page": 1, "type": "text", "rect": [34.4726, 417.419, 582.435, 487.419]}, {"page": 1, "type": "text", "rect": [34.0363, 376.924, 581.999, 406.343]}, {"page": 1, "type": "text", "rect": [509.235, 282.059, 567.599, 298.823]}]}