{"version": 1, "source_pdf": "aab2882c5776.pdf", "origin": "stripped", "family": "real/Corel", "pages": [{"page": 1, "width": 630.0, "height": 810.0}, {"page": 2, "width": 630.0, "height": 810.0}], "widgets": [{"page": 1, "type": "text", "rect": [41.2365, 683.715, 568.911, 694.239]}, {"page": 1, "type": "text", "rect": [41.2365, 665.541, 206.291, 676.065]}, {"page": 1, "type": "text", "rect": [77.8913, 647.672, 173.564, 658.197]}, {"page": 1, "type": "text", "rect": [39.5421, 630.042, 406.198, 640.566]}, {"page": 1, "type": "text", "rect": [41.8911, 578.486, 432.765, 589.01]}, {"page": 1, "type": "text", "rect": [41.8911, 559.62, 570.875, 570.145]}, {"page": 1, "type": "text", "rect": [108.218, 374.219, 343.309, 386.619]}, {"page": 1, "type": "text", "rect": [42.7635, 353.71, 411.381, 366.11]}, {"page": 1, "type": "text", "rect": [41.4545, 167.383, 567.599, 179.783]}, {"page": 1, "type": "text", "rect": [75.4907, 62.6561, 231.163, 75.0562]}, {"page": 1, "type": "text", "rect": [452.944, 62.6561, 557.563, 75.0562]}]}